{
  "_meta": {
    "sources": [
      {
        "json": "SJMAiS",
        "abbreviation": "SJMAiS",
        "full": "Spelljammer - More Adventures in Space",
        "authors": [
          "Sesserdrix"
        ],
        "convertedBy": [
          "Surge"
        ],
        "url": "https://www.dropbox.com/sh/3c88jrhy1t7gyql/AACS63QaKFCCrBn_-cxRVHBda",
        "version": "0.94",
        "targetSchema": "1.0.0"
      }
    ],
    "dateAdded": 1616108022,
    "dateLastModified": 1616108022
  },
  "itemType": [
    {
      "abbreviation": "SJW",
      "source": "SJMAiS",
      "name": "Spelljammer Weapon",
      "entries": [
        {
          "type": "entries",
          "name": "Spelljammer Weapon",
          "entries": [
            "This weapon must be mounted in a Spelljammer to be operated. It deals mega damage and may only target other Spelljammer vessels or mega-sized creatures."
          ]
        }
      ]
    }
  ],
  "itemProperty": [
    {
      "abbreviation": "BF2",
      "source": "SJMAiS",
      "entries": [
        {
          "type": "entries",
          "name": "Backfire 2",
          "entries": [
            "When you make an attack with this weapon, if the unmodified die roll is equal or less than 2, the weapon breaks after the attack. The weapon remains broken until the Gunner uses their action to repair it."
          ]
        }
      ]
    },
    {
      "abbreviation": "BF3",
      "source": "SJMAiS",
      "entries": [
        {
          "type": "entries",
          "name": "Backfire 3",
          "entries": [
            "When you make an attack with this weapon, if the unmodified die roll is equal or less than 3, the weapon breaks after the attack. The weapon remains broken until the Gunner uses their action to repair it."
          ]
        }
      ]
    },
    {
      "abbreviation": "BF4",
      "source": "SJMAiS",
      "entries": [
        {
          "type": "entries",
          "name": "Backfire 4",
          "entries": [
            "When you make an attack with this weapon, if the unmodified die roll is equal or less than 4, the weapon breaks after the attack. The weapon remains broken until the Gunner uses their action to repair it."
          ]
        }
      ]
    },
    {
      "abbreviation": "CRW1",
      "source": "SJMAiS",
      "entries": [
        {
          "type": "entries",
          "name": "Crew 1",
          "entries": [
            "This weapon requires 1 additional crew member to operate."
            ]
        }
      ]
    },
    {
      "abbreviation": "CRW2",
      "source": "SJMAiS",
      "entries": [
        {
          "type": "entries",
          "name": "Crew 2",
          "entries": [
            "This weapon requires 2 additional crew members to operate."
            ]
        }
      ]
    },
    {
      "abbreviation": "CRW3",
      "source": "SJMAiS",
      "entries": [
        {
          "type": "entries",
          "name": "Crew 3",
          "entries": [
            "This weapon requires 3 additional crew members to operate."
            ]
        }
      ]
    },
    {
      "abbreviation": "CRW4",
      "source": "SJMAiS",
      "entries": [
        {
          "type": "entries",
          "name": "Crew 4",
          "entries": [
            "This weapon requires 4 additional crew members to operate."
            ]
        }
      ]
    },
    {
      "abbreviation": "CRW5",
      "source": "SJMAiS",
      "entries": [
        {
          "type": "entries",
          "name": "Crew 5",
          "entries": [
            "This weapon requires 5 additional crew members to operate."
            ]
        }
      ]
    },
    {
      "abbreviation": "CRW6",
      "source": "SJMAiS",
      "entries": [
        {
          "type": "entries",
          "name": "Crew 6",
          "entries": [
            "This weapon requires 6 additional crew members to operate."
            ]
        }
      ]
    },
    {
      "abbreviation": "CRW8",
      "source": "SJMAiS",
      "entries": [
        {
          "type": "entries",
          "name": "Crew 8",
          "entries": [
            "This weapon requires 8 additional crew members to operate."
            ]
        }
      ]
    },
    {
      "abbreviation": "FX",
      "source": "SJMAiS",
      "entries": [
        {
          "type": "entries",
          "name": "Fixed",
          "entries": [
            "When mounted, this weapon is affixed to face a certain direction. It can only make attacks against targets within a 90-degree cone in the direction it is facing."
            ]
        }
      ]
    },
    {
      "abbreviation": "OVH",
      "source": "SJMAiS",
      "entries": [
        {
          "type": "entries",
          "name": "Overheat",
          "entries": [
            "Once you make an attack with this weapon, it can't be used again to make an attack until the end of your next turn."
            ]
        }
      ]
    },
    {
      "abbreviation": "SPC",
      "source": "SJMAiS",
      "entries": [
        {
          "type": "entries",
          "name": "Special",
          "entries": [
            "This weapon deals double damage to bulwark points."
            ]
        }
      ]
    },
    {
      "abbreviation": "SZS",
      "source": "SJMAiS",
      "entries": [
        {
          "type": "entries",
          "name": "Small",
          "entries": [
            "This weapon may be mounted in a small hardpoint or greater."
            ]
        }
      ]
    },
    {
      "abbreviation": "SZM",
      "source": "SJMAiS",
      "entries": [
        {
          "type": "entries",
          "name": "Medium",
          "entries": [
            "This weapon may be mounted in a medium hardpoint or greater."
            ]
        }
      ]
    },
    {
      "abbreviation": "SZL",
      "source": "SJMAiS",
      "entries": [
        {
          "type": "entries",
          "name": "Large",
          "entries": [
            "This weapon must be mounted in a large hardpoint."
            ]
        }
      ]
    }
  ],
  "item": [
    {
      "name": "Light Ballista",
      "source": "SJMAiS",
      "page": 21,
      "type": "SJW",
      "property": [
        "A",
        "SZS"
      ],
      "range": "2500/7500",
      "dmg1": "2d4",
      "dmgType": "P",
      "value": 100000,
      "entries": [
        "These top loaded siege weapons look much like a large crossbow. Unlike some models of ballista which are anchored to the ground at two points, the spelljammer variants have a central reinforced beam on a pivot. The Heavy Ballista makes use of a two-point anchor, but it rests on manually rotating platform that supporting crew can turn to help aim."
      ]
    },
    {
      "name": "Medium Ballista",
      "source": "SJMAiS",
      "page": 21,
      "type": "SJW",
      "property": [
        "A",
        "CRW1",
        "SZM"
      ],
      "range": "3000/9000",
      "dmg1": "2d6",
      "dmgType": "P",
      "value": 200000,
      "entries": [
        "These top loaded siege weapons look much like a large crossbow. Unlike some models of ballista which are anchored to the ground at two points, the spelljammer variants have a central reinforced beam on a pivot. The Heavy Ballista makes use of a two-point anchor, but it rests on manually rotating platform that supporting crew can turn to help aim."
      ]
    },
    {
      "name": "Heavy Ballista",
      "source": "SJMAiS",
      "page": 21,
      "type": "SJW",
      "property": [
        "A",
        "CRW2",
        "SZL"
      ],
      "range": "3500/10500",
      "dmg1": "2d8",
      "dmgType": "P",
      "value": 400000,
      "entries": [
        "These top loaded siege weapons look much like a large crossbow. Unlike some models of ballista which are anchored to the ground at two points, the spelljammer variants have a central reinforced beam on a pivot. The Heavy Ballista makes use of a two-point anchor, but it rests on manually rotating platform that supporting crew can turn to help aim."
      ]
    },
    {
      "name": "Light Catapult",
      "source": "SJMAiS",
      "page": 21,
      "type": "SJW",
      "property": [
        "A",
        "CRW1",
        "FX",
        "SZS"
      ],
      "range": "3500/10500",
      "dmg1": "3d4",
      "dmgType": "B",
      "value": 100000,
      "entries": [
        "A classic siege weapon that uses stored up tension in a single limb to release some projectile at high speeds toward a target. Many traditional catapults have lockable wheels so they can be moved and fired, but the spelljammer variant is built into the hardpoint itself."
      ]
    },
    {
      "name": "Medium Catapult",
      "source": "SJMAiS",
      "page": 21,
      "type": "SJW",
      "property": [
        "A",
        "CRW3",
        "FX",
        "SZM"
      ],
      "range": "4000/12000",
      "dmg1": "3d6",
      "dmgType": "B",
      "value": 200000,
      "entries": [
        "A classic siege weapon that uses stored up tension in a single limb to release some projectile at high speeds toward a target. Many traditional catapults have lockable wheels so they can be moved and fired, but the spelljammer variant is built into the hardpoint itself."
      ]
    },
    {
      "name": "Heavy Catapult",
      "source": "SJMAiS",
      "page": 21,
      "type": "SJW",
      "property": [
        "A",
        "CRW5",
        "FX",
        "SZL"
      ],
      "range": "4500/13500",
      "dmg1": "3d8",
      "dmgType": "B",
      "value": 400000,
      "entries": [
        "A classic siege weapon that uses stored up tension in a single limb to release some projectile at high speeds toward a target. Many traditional catapults have lockable wheels so they can be moved and fired, but the spelljammer variant is built into the hardpoint itself."
      ]
    },
    {
      "name": "Carronade",
      "source": "SJMAiS",
      "page": 21,
      "type": "SJW",
      "property": [
        "A",
        "BF2",